{"schema":"mm/v2/apply-receipt","attemptId":"att_abcdefghijklmnopqrstuvwxyzABCDEF","stageId":"stg_abcdefghijklmnopqrstuvwxyzABCDEF","revision":2,"semanticDigest":"0123456789abcdef0123456789abcdef0123456789abcdef0123456789abcdef","operation":"create_post","recoveryMode":"ordinary","forcedDuplicateRisk":false,"destination":{"kind":"conversation","channelId":"channel-1","channelType":"dm","teamId":null,"postId":null,"rootPostId":null,"participantIds":["user-2"],"emoji":null,"postState":null,"reactionPresent":null},"outcome":"succeeded","recovery":"forbidden","startedAt":"2026-07-17T02:00:00Z","recordedAt":"2026-07-17T02:00:01Z","steps":[{"ordinal":1,"kind":"create_post","condition":"always","state":"response_validated","result":{"postId":"post-1","createAt":1784253600000,"channelId":"channel-1","userId":"user-1","pendingPostId":"pending_abcdefghijklmnopqrstuvwxyzAB"},"startedAt":"2026-07-17T02:00:00Z","endedAt":"2026-07-17T02:00:01Z"}]}
